{
  "schema": "starpi.receipt/v2",
  "id": "ff758532a18dda1d792f480039a44c19953f9fe9412e106559722bf2b0fc0dcb",
  "createdAt": "2026-10-16T08:00:00.000Z",
  "generator": {
    "name": "starpi",
    "version": "2.1.0"
  },
  "answer": {
    "text": "The approved budget for Project Nebula is 480,000 EUR [Doc: nebula-plan.md, Chunk: 1]. The public launch is planned for 12 June 2027 [Doc: nebula-plan.md, Chunk: 1].",
    "sha256": "5a2ca3c354db64690be68a99ab2966815848edde76f96f64db0c143acd0c865e",
    "engine": "cloud",
    "locale": "en"
  },
  "question": {
    "text": "Budget and launch?"
  },
  "citations": [
    {
      "label": "[Doc: nebula-plan.md, Chunk: 1]",
      "doc": "nebula-plan.md",
      "heading": "",
      "source": "workspace",
      "delivered": "full",
      "excerpt": {
        "text": "# Project Nebula: project plan\n\n> Sample document for the Starpi demo. The company, the people and all figures are fictitious.\n\n## Summary\n\nProject Nebula replaces the route planning system of Helio Freight with a self-hosted planner. The public launch of Project Nebula is planned for 12 May 2027. Lena Park leads development; Tom Becker is the product owner.\n\n## Budget\n\nThe approved budget for Project Nebula is 480,000 EUR.",
        "sha256": "7a049fa1469413ad854978c0079294975aacff852eb83dac0c16495fbac4925e",
        "truncated": false
      },
      "verifiable": true,
      "document": {
        "name": "nebula-plan.md",
        "kind": "md",
        "bytes": 1028,
        "fileSha256": "669f7c8278ae89bf50b5b6ffcac2fa1193f3c76949a90a9f1846a34e2baab7a5",
        "textSha256": "669f7c8278ae89bf50b5b6ffcac2fa1193f3c76949a90a9f1846a34e2baab7a5",
        "textChars": 1028,
        "pages": null,
        "extractor": {
          "id": "starpi-extract",
          "version": 2,
          "pdfjs": null
        },
        "chunker": {
          "id": "starpi-chunk",
          "version": 1,
          "size": 500,
          "overlap": 50
        }
      },
      "chunk": {
        "index": 0,
        "start": 0,
        "end": 427,
        "sha256": "7a049fa1469413ad854978c0079294975aacff852eb83dac0c16495fbac4925e"
      },
      "proof": [
        "489a564772fa41d0c97289f64856902015038db3ad30837688beb7c621567c5b",
        "20c11f33deedaedd80be161108461c1009b97085b1818db75aec94595227d14c"
      ]
    },
    {
      "label": "[Doc: nebula-plan.md, Chunk: 2]",
      "doc": "nebula-plan.md",
      "heading": "",
      "source": "workspace",
      "delivered": "full",
      "excerpt": {
        "text": "approved budget for Project Nebula is 480,000 EUR. It is split into 310,000 EUR for development, 95,000 EUR for infrastructure and 75,000 EUR for training and rollout. The steering group approved the budget on 3 March 2026.\n\n## Milestones\n\n- Kickoff: 14 September 2026\n- Beta at the Hamburg depot: 1 February 2027\n- Public launch: 12 May 2027\n\n## Team and meetings\n\nThe core team has 9 people: 5 developers, 2 data engineers, 1 designer and 1 product owner.",
        "sha256": "5ee5f913fe541885760b09bbde2835d865895bc44a0e8bdd3c7e997476fcbb58",
        "truncated": false
      },
      "verifiable": true,
      "document": {
        "name": "nebula-plan.md",
        "kind": "md",
        "bytes": 1028,
        "fileSha256": "669f7c8278ae89bf50b5b6ffcac2fa1193f3c76949a90a9f1846a34e2baab7a5",
        "textSha256": "669f7c8278ae89bf50b5b6ffcac2fa1193f3c76949a90a9f1846a34e2baab7a5",
        "textChars": 1028,
        "pages": null,
        "extractor": {
          "id": "starpi-extract",
          "version": 2,
          "pdfjs": null
        },
        "chunker": {
          "id": "starpi-chunk",
          "version": 1,
          "size": 500,
          "overlap": 50
        }
      },
      "chunk": {
        "index": 1,
        "start": 377,
        "end": 834,
        "sha256": "5ee5f913fe541885760b09bbde2835d865895bc44a0e8bdd3c7e997476fcbb58"
      },
      "proof": [
        "44d4876a48448acf1568b82bc7a2c4e8ba2aa5cda0a5176a69ace9ae88ec07f7",
        "20c11f33deedaedd80be161108461c1009b97085b1818db75aec94595227d14c"
      ]
    },
    {
      "label": "[Doc: nebula-risks.csv, Chunk: 1]",
      "doc": "nebula-risks.csv",
      "heading": "",
      "source": "workspace",
      "delivered": "full",
      "excerpt": {
        "text": "id: R-01; risk: Delay of the traffic data supplier; rating: High; owner: Marta Silva; mitigation: Second supplier under contract by 30 November 2026\nid: R-02; risk: Drivers reject the new app; rating: Medium; owner: Tom Becker; mitigation: Pilot with 20 drivers at the Hamburg depot\nid: R-03; risk: Cloud costs exceed the infrastructure budget; rating: High; owner: Lena Park; mitigation: Monthly cost review with a hard limit of 8000 EUR per month\nid: R-04; risk: Data protection review takes",
        "sha256": "0708ceac37e634337d6abca4026c24cd611a3a93f6e1bb5421a04259ada604e5",
        "truncated": false
      },
      "verifiable": true,
      "document": {
        "name": "nebula-risks.csv",
        "kind": "csv",
        "bytes": 461,
        "fileSha256": "97dcd9795adcffc8d8e01504ebee74645a614a13ab1d48a4e874d873b04bae0c",
        "textSha256": "d6a77407d33705a1c5ddeb7f42e86fb2ead5221ac95f9c84f4bcd5ef91fc54c2",
        "textChars": 592,
        "pages": null,
        "extractor": {
          "id": "starpi-extract",
          "version": 2,
          "pdfjs": null
        },
        "chunker": {
          "id": "starpi-chunk",
          "version": 1,
          "size": 500,
          "overlap": 50
        }
      },
      "chunk": {
        "index": 0,
        "start": 0,
        "end": 493,
        "sha256": "0708ceac37e634337d6abca4026c24cd611a3a93f6e1bb5421a04259ada604e5"
      },
      "proof": [
        "b182f381161040aefa58a15619ecaac09268446ee1067457eb06acc3f25e7da3",
        "b748ab2ef4f007f68a9d4bb1f13d3b0702ec22e33e4e2e2105eb29d648caf1b4"
      ]
    },
    {
      "label": "[Doc: nebula-risks.csv, Chunk: 2]",
      "doc": "nebula-risks.csv",
      "heading": "",
      "source": "workspace",
      "delivered": "full",
      "excerpt": {
        "text": "onth\nid: R-04; risk: Data protection review takes longer than planned; rating: Low; owner: Jonas Weber; mitigation: Start the review in October 2026",
        "sha256": "974c047d5bca8e95e60ea9ecdc65ad6e64a2c4a8ae86212ed05d6ab75fd19d1d",
        "truncated": false
      },
      "verifiable": true,
      "document": {
        "name": "nebula-risks.csv",
        "kind": "csv",
        "bytes": 461,
        "fileSha256": "97dcd9795adcffc8d8e01504ebee74645a614a13ab1d48a4e874d873b04bae0c",
        "textSha256": "d6a77407d33705a1c5ddeb7f42e86fb2ead5221ac95f9c84f4bcd5ef91fc54c2",
        "textChars": 592,
        "pages": null,
        "extractor": {
          "id": "starpi-extract",
          "version": 2,
          "pdfjs": null
        },
        "chunker": {
          "id": "starpi-chunk",
          "version": 1,
          "size": 500,
          "overlap": 50
        }
      },
      "chunk": {
        "index": 1,
        "start": 444,
        "end": 592,
        "sha256": "974c047d5bca8e95e60ea9ecdc65ad6e64a2c4a8ae86212ed05d6ab75fd19d1d"
      },
      "proof": [
        "0a69e7849907aa31e62403c2fbb752a526bab0841689fc187ba9eb446d24cadc",
        "b748ab2ef4f007f68a9d4bb1f13d3b0702ec22e33e4e2e2105eb29d648caf1b4"
      ]
    }
  ],
  "grounding": {
    "algorithm": {
      "id": "starpi-grounding",
      "version": 2
    },
    "counts": {
      "supported": 1,
      "weak": 0,
      "unsupported": 1,
      "unchecked": 0
    },
    "sentences": [
      {
        "text": "The approved budget for Project Nebula is 480,000 EUR.",
        "cites": [
          0
        ],
        "citeSource": "own",
        "verdict": "supported",
        "reasons": []
      },
      {
        "text": "The public launch is planned for 12 June 2027.",
        "cites": [
          0
        ],
        "citeSource": "own",
        "verdict": "unsupported",
        "reasons": [
          {
            "code": "missing_fact",
            "level": "unsupported",
            "fact": "12 June 2027",
            "cites": [
              0
            ]
          }
        ]
      }
    ]
  },
  "merkle": {
    "alg": "sha256-rfc6962",
    "size": 4,
    "root": "037580d43da09f695dd60533fb7d4195bd07173d25846a07e4789abf7006a979"
  },
  "signature": {
    "alg": "Ed25519",
    "keyId": "b53448a2b59a419cb918fdfc474a335b40c7a2e3393cad2e0bce5621400d6807",
    "publicKey": {
      "kty": "OKP",
      "crv": "Ed25519",
      "x": "yzlfkgYHkAtG-wxJpeDxGGpGZZo9z0F5A3UN0FPulJ4"
    },
    "value": "VX3D2LmSbjIkPJSWF3-rgxgaqPooPNHbjO3osViVeorg2iBbDT2mtiMF762YYv4b5CFm4RJbQU_oUULXtIaICw"
  }
}
